{
  "policy_id": "query_policy_dashboard_probe_read",
  "organization_id": "org_123",
  "project_id": "project_123",
  "environment_id": "env_123",
  "name": "dashboard_probe_read",
  "table_schema": "public",
  "table_name": "dashboard_probe",
  "operation": "read",
  "principal_claim": "sub",
  "predicate_sql": "true",
  "sample_context": {
    "sub": "user_123",
    "role": "developer"
  },
  "status": "active"
}
